<?xml version="1.0" encoding="UTF-8"?>
<!DOCTYPE students  SYSTEM  "Practice.dtd">
<students>
     <student id="101">
      <name title="ms">
        <first>Rashmi</first>
        <middle></middle>
        <last>Pariyar</last>
      </name>
      <phone type="personal">98xxxxxxxx</phone>
      <email>rasmi@gmail.com</email>
           <college id="57">
          <c_name>Padmakanya Multiple Campus</c_name>
          <address>Swoyambhu</address>
          <website>www.rasmi.com.np</website>
        </college>
        <program type="semester">BCA</program>
        <duration>Two year</duration>
    </student>
    
    <student id="102">
        <name title="ms">
            <first>Alisha</first>
            <middle></middle>
            <last>Limbu</last>
        </name>
        <phone type="personal">98xxxxxxxxx</phone>
        <email>alisha2@gmail.com</email>
            <college id="1">
            <c_name>Padmakanya Multiple Campus</c_name>
            <address>Kalanki</address>
          <website>www.alishaaa.com.np</website>
        <program type="semester">BCA</program>
        <duration>Two year</duration>
            </college>
    </student>
  </students>